{
  "version": 1,
  "name": "dialogporten",
  "enabled": true,
  "rules": [
    {
      "id": "write-any",
      "enabled": true,
      "keyMode": "client-id",
      "calls": 15,
      "renewalPeriod": 60,
      "match": {
        "methods": [
          "POST"
        ],
        "pathMode": "any"
      }
    }
  ]
}
