{
  "version": 1,
  "name": "dialogporten",
  "enabled": false,
  "rules": [
    {
      "id": "ignored",
      "enabled": true,
      "keyMode": "client-id",
      "calls": 10,
      "renewalPeriod": 60,
      "match": {
        "methods": [
          "*"
        ],
        "pathMode": "any"
      }
    }
  ]
}
