{
  "version": 1,
  "name": "dialogporten",
  "enabled": true,
  "rules": [
    {
      "id": "instance-read",
      "enabled": true,
      "keyMode": "client-id-ip",
      "calls": 30,
      "renewalPeriod": 10,
      "match": {
        "methods": [
          "GET"
        ],
        "pathMode": "exact",
        "path": "/dialogporten/api/v1/serviceowner/instances"
      }
    }
  ]
}
