{
  "version": 1,
  "name": "dialogporten",
  "enabled": true,
  "rules": [
    {
      "id": "burst",
      "enabled": true,
      "keyMode": "client-id",
      "calls": 20,
      "renewalPeriod": 10,
      "match": {
        "methods": [
          "*"
        ],
        "pathMode": "prefix",
        "path": "/dialogporten"
      }
    },
    {
      "id": "sustained",
      "enabled": true,
      "keyMode": "client-id",
      "calls": 300,
      "renewalPeriod": 300,
      "match": {
        "methods": [
          "*"
        ],
        "pathMode": "prefix",
        "path": "/dialogporten"
      }
    }
  ]
}
