{
  "version": 1,
  "name": "dialogporten",
  "enabled": true,
  "rules": [
    {
      "id": "disabled",
      "enabled": false,
      "keyMode": "client-id",
      "calls": 10,
      "renewalPeriod": 60,
      "match": {
        "methods": [
          "GET"
        ],
        "pathMode": "exact",
        "path": "/ignored"
      }
    }
  ]
}
