{
  "version": 1,
  "name": "dialogporten",
  "enabled": true,
  "rules": [
    {
      "id": "jwt",
      "enabled": true,
      "keyMode": "client-id",
      "calls": 5,
      "renewalPeriod": 60,
      "match": {
        "methods": [
          "GET"
        ],
        "pathMode": "prefix",
        "path": "/jwt"
      }
    }
  ]
}
